{
  "events": [
    {
      "id": "varna_тракийскиятвойнизложба_20251231",
      "title": "\"Тракийският войн\" - изложба",
      "description": "\"Тракийският войн\" - изложба 30.06 - 31.12.2025г. Археологически музей, ет.1, зала \"Юг\" В понеделник, 30 ю... Понеделник, 30/06/2025г.-Сряда, 31/12/2025г.",
      "startDate": "2025-12-31T00:00:00.000Z",
      "endDate": "2025-12-31T00:00:00.000Z",
      "location": {
        "address": "\"Тракийският войн\" - изложба 30",
        "city": "Варна",
        "country": "България",
        "coordinates": null
      },
      "category": "Култура",
      "price": 0,
      "isOnline": false,
      "imageUrl": "https://visit.varna.bg/media/cache/69/30//thumb2__войн.jpg",
      "websiteUrl": "https://visit.varna.bg/bg/event/trakiyskiyat-voyn-izlozhba.html",
      "isExternal": true,
      "createdAt": "2025-12-09T01:24:05.422Z",
      "creatorId": null,
      "tags": []
    },
    {
      "id": "varna_диалозиiiiизложба_20251210",
      "title": "„Диалози III“ - изложба",
      "description": "„Диалози III“ - изложба 01.11 - 10.12.2025 г., 17:00 ч. Арт галерия Le Papillon / ул. &bdquo;Драгоман&ldquo; 12 ... Събота, 01/11/2025г.-Сряда, 10/12/2025г.",
      "startDate": "2025-12-10T00:00:00.000Z",
      "endDate": "2025-12-10T00:00:00.000Z",
      "location": {
        "address": "„Диалози III“ - изложба 01",
        "city": "Варна",
        "country": "България",
        "coordinates": null
      },
      "category": "Култура",
      "price": 0,
      "isOnline": false,
      "imageUrl": "https://visit.varna.bg/media/cache/dd/21//thumb2_le_papillon.jpg",
      "websiteUrl": "https://visit.varna.bg/bg/event/dialozi-ii-izlozhba.html",
      "isExternal": true,
      "createdAt": "2025-12-09T01:24:05.423Z",
      "creatorId": null,
      "tags": []
    },
    {
      "id": "varna_пътятнагеоргилечевизложба_20251114",
      "title": "„Пътят“ на Георги Лечев - изложба",
      "description": "„Пътят“ на Георги Лечев - изложба 14.11.2025 г. - 10.12.2025 г. Градската художествена галерия &bdquo;Борис Георгиев&ldquo; ... Петък, 14/11/2025г.-Сряда, 10/12/2025г.",
      "startDate": "2025-11-14T00:00:00.000Z",
      "endDate": "2025-12-10T00:00:00.000Z",
      "location": {
        "address": "„Пътят“ на Георги Лечев - изложба 14",
        "city": "Варна",
        "country": "България",
        "coordinates": null
      },
      "category": "Култура",
      "price": 0,
      "isOnline": false,
      "imageUrl": "https://visit.varna.bg/media/cache/60/91//thumb2_The_road.png",
      "websiteUrl": "https://visit.varna.bg/bg/event/patyat-na-georgi-lechev-izlozhba.html",
      "isExternal": true,
      "createdAt": "2025-12-09T01:24:05.423Z",
      "creatorId": null,
      "tags": []
    },
    {
      "id": "varna_цветнидиханияизложба_20251212",
      "title": "„Цветни дихания“ - изложба",
      "description": "„Цветни дихания“ - изложба 18.11 - 12.12.2025 г. Арт Галерия 12 на Областна администрация - Варна (ул. „Преслав“ 26)... Вторник, 18/11/2025г.-Петък, 12/12/2025г.",
      "startDate": "2025-12-12T00:00:00.000Z",
      "endDate": "2025-12-12T00:00:00.000Z",
      "location": {
        "address": "„Цветни дихания“ - изложба 18",
        "city": "Варна",
        "country": "България",
        "coordinates": null
      },
      "category": "Култура",
      "price": 0,
      "isOnline": false,
      "imageUrl": "https://visit.varna.bg/media/cache/15/24//thumb2_varna_dihaniya.jpg",
      "websiteUrl": "https://visit.varna.bg/bg/event/tsvetni-dihaniya-izlozhba.html",
      "isExternal": true,
      "createdAt": "2025-12-09T01:24:05.423Z",
      "creatorId": null,
      "tags": []
    },
    {
      "id": "varna_георгимариновизложбаскулптураи_20251211",
      "title": "Георги Маринов - изложба скулптура и живопис",
      "description": "Георги Маринов - изложба скулптура и живопис 20.11 - 11.12.2025 г. Le Papillon Art Gallery Откриване на изложбата &ndash; четвъртък... Четвъртък, 20/11/2025г.-Четвъртък, 11/12/2025г.",
      "startDate": "2025-12-11T00:00:00.000Z",
      "endDate": "2025-12-11T00:00:00.000Z",
      "location": {
        "address": null,
        "city": "Варна",
        "country": "България",
        "coordinates": null
      },
      "category": "Култура",
      "price": 0,
      "isOnline": false,
      "imageUrl": "https://visit.varna.bg/media/cache/35/71//thumb2_exhibition_new.jpg",
      "websiteUrl": "https://visit.varna.bg/bg/event/georgi-marinov-izlozhba-skulptura-i-zhivopis.html",
      "isExternal": true,
      "createdAt": "2025-12-09T01:24:05.424Z",
      "creatorId": null,
      "tags": []
    },
    {
      "id": "varna_коледенбазар_20260104",
      "title": "„Коледен базар“",
      "description": "„Коледен базар“ 21.11 - 04.01.2026 г., 17:00 ч. Варна Fun Port / Морска гара За поредна година „Varna F... Петък, 21/11/2025г.-Неделя, 04/01/2026г.",
      "startDate": "2026-01-04T00:00:00.000Z",
      "endDate": "2026-01-04T00:00:00.000Z",
      "location": {
        "address": null,
        "city": "Варна",
        "country": "България",
        "coordinates": null
      },
      "category": "Култура",
      "price": 0,
      "isOnline": false,
      "imageUrl": "https://visit.varna.bg/media/cache/a6/4c//thumb2_567.jpg",
      "websiteUrl": "https://visit.varna.bg/bg/event/koleden-bazar-otkrivane.html",
      "isExternal": true,
      "createdAt": "2025-12-09T01:24:05.424Z",
      "creatorId": null,
      "tags": []
    },
    {
      "id": "varna_varnaweddingexpo2025meanttobeс_20251123",
      "title": "VARNA WEDDING EXPO 2025: MEANT TO BE – сватбено изложение",
      "description": "VARNA WEDDING EXPO 2025: MEANT TO BE – сватбено изложение 22&ndash;23.11.2025г. 10:00ч. Хотел &bdquo;Черно Море\" VARNA WEDDING EXPO 2025: ME... Събота, 22/11/2025г.-Вторник, 23/12/2025г.",
      "startDate": "2025-11-23T00:00:00.000Z",
      "endDate": "2025-11-23T00:00:00.000Z",
      "location": {
        "address": "VARNA WEDDING EXPO 2025: MEANT TO BE – сватбено изложение 22&ndash",
        "city": "Варна",
        "country": "България",
        "coordinates": null
      },
      "category": "Култура",
      "price": 0,
      "isOnline": false,
      "imageUrl": "https://visit.varna.bg/media/cache/46/28//thumb2_533.jpg",
      "websiteUrl": "https://visit.varna.bg/bg/event/varna-wedding-expo-2025-meant-to-be-nay-golyamoto-.html",
      "isExternal": true,
      "createdAt": "2025-12-09T01:24:05.424Z",
      "creatorId": null,
      "tags": []
    },
    {
      "id": "varna_коледенмузикаленфестивал26тоиз_20251122",
      "title": "„Коледен музикален фестивал“ - 26-то издание",
      "description": "„Коледен музикален фестивал“ - 26-то издание 22.11.2025 - 31.12.2025 г. Държавна опера Варна Програма: 22.11.2025 ... Събота, 22/11/2025г.-Сряда, 31/12/2025г.",
      "startDate": "2025-11-22T00:00:00.000Z",
      "endDate": "2025-12-31T00:00:00.000Z",
      "location": {
        "address": "„Коледен музикален фестивал“ - 26-то издание 22",
        "city": "Варна",
        "country": "България",
        "coordinates": null
      },
      "category": "Култура",
      "price": 0,
      "isOnline": false,
      "imageUrl": "https://visit.varna.bg/media/cache/31/ab//thumb2_64464.jpg",
      "websiteUrl": "https://visit.varna.bg/bg/event/koleden-muzikalen-festival-26-izdanie.html",
      "isExternal": true,
      "createdAt": "2025-12-09T01:24:05.424Z",
      "creatorId": null,
      "tags": []
    },
    {
      "id": "varna_коледнаградинкачаталджа_20251122",
      "title": "Коледна градинка Чаталджа",
      "description": "Коледна градинка Чаталджа 22.11.2025г. - 31.12.2025г. &bdquo;Чаталджа\" - Коледна градинка Коледното вълшебст... Събота, 22/11/2025г.-Сряда, 31/12/2025г.",
      "startDate": "2025-11-22T00:00:00.000Z",
      "endDate": "2025-12-31T00:00:00.000Z",
      "location": {
        "address": null,
        "city": "Варна",
        "country": "България",
        "coordinates": null
      },
      "category": "Култура",
      "price": 0,
      "isOnline": false,
      "imageUrl": "https://visit.varna.bg/media/cache/1b/9c//thumb2_koledna-gradinka-1-3-640x427.jpeg",
      "websiteUrl": "https://visit.varna.bg/bg/event/koledna-gradinka-chataldzha.html",
      "isExternal": true,
      "createdAt": "2025-12-09T01:24:05.424Z",
      "creatorId": null,
      "tags": []
    },
    {
      "id": "varna_николаманев85годиниотрождениет_20251211",
      "title": "Никола Манев – 85 години от рождението на художника - изложба",
      "description": "Никола Манев – 85 години от рождението на художника - изложба 24.11 - 11.12.2025г. Галерия 33 / ул.&bdquo;Габрово&ldquo; 2А Никола Манев (1940&... Вторник, 25/11/2025г.-Четвъртък, 11/12/2025г.",
      "startDate": "2025-12-11T00:00:00.000Z",
      "endDate": "2025-12-11T00:00:00.000Z",
      "location": {
        "address": "Никола Манев – 85 години от рождението на художника - изложба 24",
        "city": "Варна",
        "country": "България",
        "coordinates": null
      },
      "category": "Култура",
      "price": 0,
      "isOnline": false,
      "imageUrl": "https://visit.varna.bg/media/cache/f0/b1//thumb2_plakat_n.manev3.jpg",
      "websiteUrl": "https://visit.varna.bg/bg/event/nikola-manev-85-godini-ot-rozhdenieto-na-hudozhnik.html",
      "isExternal": true,
      "createdAt": "2025-12-09T01:24:05.425Z",
      "creatorId": null,
      "tags": []
    },
    {
      "id": "varna_xviколеднитеатралниседмици2025_20251126",
      "title": "„XVI Коледни театрални седмици“ 2025",
      "description": "„XVI Коледни театрални седмици“ 2025 26.11.2025 - 22.12.2025 г. ДТ &bdquo;Ст.Бъчваров&ldquo; Варна Програма: 2... Сряда, 26/11/2025г.-Понеделник, 22/12/2025г.",
      "startDate": "2025-11-26T00:00:00.000Z",
      "endDate": "2025-12-22T00:00:00.000Z",
      "location": {
        "address": null,
        "city": "Варна",
        "country": "България",
        "coordinates": null
      },
      "category": "Култура",
      "price": 0,
      "isOnline": false,
      "imageUrl": "https://visit.varna.bg/media/cache/e4/99//thumb2_5814539129870_n.jpg",
      "websiteUrl": "https://visit.varna.bg/bg/event/xvi-koledni-teatralni-sedmitsi-2025.html",
      "isExternal": true,
      "createdAt": "2025-12-09T01:24:05.425Z",
      "creatorId": null,
      "tags": []
    },
    {
      "id": "varna_галерияларгоотбелязвасвоя17тир",
      "title": "Галерия Ларго отбелязва своя 17-ти рожден ден с две изложби графика",
      "description": "Галерия Ларго отбелязва своя 17-ти рожден ден с две изложби графика 26.11 - 09.12. 2025г., Държавен архив - Варна, откриване в 18:00ч. 27.11 - 15.12. 2025г., Гал... Сряда, 26/11/2025г.-Понеделник, 15/12/2025г.",
      "startDate": "2025-12-09T01:24:05.425Z",
      "endDate": "2025-12-09T01:24:05.425Z",
      "location": {
        "address": "Галерия Ларго отбелязва своя 17-ти рожден ден с две изложби графика 26",
        "city": "Варна",
        "country": "България",
        "coordinates": null
      },
      "category": "Култура",
      "price": 0,
      "isOnline": false,
      "imageUrl": "https://visit.varna.bg/media/cache/8c/32//thumb2_baner-dve_izlozhbi-Largo_Gallery.jpg",
      "websiteUrl": "https://visit.varna.bg/bg/event/galeriya-largo-otbelyazva-svoya-17-ti-rozhden-den-.html",
      "isExternal": true,
      "createdAt": "2025-12-09T01:24:05.425Z",
      "creatorId": null,
      "tags": []
    },
    {
      "id": "varna_полетпредставителнасборнаиложб",
      "title": "„Полет“ - представителна сборна и��ложба графика „Полет“ на 13 съвременни български и италиански художници",
      "description": "„Полет“ - представителна сборна и��ложба графика „Полет“ на 13 съвременни български и италиански художници 27 Ноември - 15 Декември 2025г. Арт галерия Ларго Откриване на изложбата на 27 Ноември 202... Четвъртък, 27/11/2025г.-Понеделник, 15/12/2025г.",
      "startDate": "2025-12-09T01:24:06.615Z",
      "endDate": "2025-12-09T01:24:06.615Z",
      "location": {
        "address": "„Полет“ - представителна сборна и��ложба графика „Полет“ на 13 съвременни български и италиански художници 27 Ноември - 15 Декември 2025г",
        "city": "Варна",
        "country": "България",
        "coordinates": null
      },
      "category": "Култура",
      "price": 0,
      "isOnline": false,
      "imageUrl": "https://visit.varna.bg/media/cache/9e/d0//thumb2_flight_poster.jpg",
      "websiteUrl": "https://visit.varna.bg/bg/event/polet-predstavitelna-sborna-izlozhba-grafika.html",
      "isExternal": true,
      "createdAt": "2025-12-09T01:24:06.615Z",
      "creatorId": null,
      "tags": []
    },
    {
      "id": "varna_тихикнигиизложба_20260108",
      "title": "„Тихи книги“ - изложба",
      "description": "„Тихи книги“ - изложба 03.12 - 08.01.2026 г. 17:00 ч. Регионалната библиотека \"Пенчо Славейков\" На 3... Сряда, 03/12/2025г.-Четвъртък, 08/01/2026г.",
      "startDate": "2026-01-08T00:00:00.000Z",
      "endDate": "2026-01-08T00:00:00.000Z",
      "location": {
        "address": null,
        "city": "Варна",
        "country": "България",
        "coordinates": null
      },
      "category": "Култура",
      "price": 0,
      "isOnline": false,
      "imageUrl": "https://visit.varna.bg/media/cache/cd/3f//thumb2_FB-banner-Hungarian-Institute.jpg",
      "websiteUrl": "https://visit.varna.bg/bg/event/tihi-knigi-izlozhba.html",
      "isExternal": true,
      "createdAt": "2025-12-09T01:24:06.615Z",
      "creatorId": null,
      "tags": []
    },
    {
      "id": "varna_извисяванепразничнасборнаизлож_20251204",
      "title": "„Извисяване”- празнична сборна изложба живопис и пластика",
      "description": "„Извисяване”- празнична сборна изложба живопис и пластика 04.12.2025 г. - 04.03.2026 г. галерия &bdquo;Арт Маркони&rdquo; Откриване &ndash; 4.12.2025... Четвъртък, 04/12/2025г.-Сряда, 04/03/2026г.",
      "startDate": "2025-12-04T00:00:00.000Z",
      "endDate": "2026-03-04T00:00:00.000Z",
      "location": {
        "address": "„Извисяване”- празнична сборна изложба живопис и пластика 04",
        "city": "Варна",
        "country": "България",
        "coordinates": null
      },
      "category": "Култура",
      "price": 0,
      "isOnline": false,
      "imageUrl": "https://visit.varna.bg/media/cache/a9/55//thumb2_590743210_26863_n.jpg",
      "websiteUrl": "https://visit.varna.bg/bg/event/izvisyavane-praznichna-sborna-izlozhba-zhivopis-i-.html",
      "isExternal": true,
      "createdAt": "2025-12-09T01:24:06.615Z",
      "creatorId": null,
      "tags": []
    },
    {
      "id": "varna_blackwildизложбатанакайо_20251231",
      "title": "„Black & Wild“ - изложбата на Кайо",
      "description": "„Black & Wild“ - изложбата на Кайо 05.12 - 31.12.2025 г., 19:00 ч. Галерия Жар Артул / ул.Шипка 15 &bdquo;Black & Wild... Петък, 05/12/2025г.-Сряда, 31/12/2025г.",
      "startDate": "2025-12-31T00:00:00.000Z",
      "endDate": "2025-12-31T00:00:00.000Z",
      "location": {
        "address": "„Black & Wild“ - изложбата на Кайо 05",
        "city": "Варна",
        "country": "България",
        "coordinates": null
      },
      "category": "Култура",
      "price": 0,
      "isOnline": false,
      "imageUrl": "https://visit.varna.bg/media/cache/c4/fc//thumb2_6447.jpg",
      "websiteUrl": "https://visit.varna.bg/bg/event/black-wild-izlozhbata-na-kayo.html",
      "isExternal": true,
      "createdAt": "2025-12-09T01:24:06.615Z",
      "creatorId": null,
      "tags": []
    },
    {
      "id": "varna_многотопътекикъмморскатаистори_20251205",
      "title": "„Многото пътеки към морската история“ - изложба",
      "description": "„Многото пътеки към морската история“ - изложба 05.12.2025 г. - 31.03.2026 г. Военноморския музей във Варна На 5 декември (петък) от 11... Петък, 05/12/2025г.-Вторник, 31/03/2026г.",
      "startDate": "2025-12-05T00:00:00.000Z",
      "endDate": "2026-03-31T00:00:00.000Z",
      "location": {
        "address": "„Многото пътеки към морската история“ - изложба 05",
        "city": "Варна",
        "country": "България",
        "coordinates": null
      },
      "category": "Култура",
      "price": 0,
      "isOnline": false,
      "imageUrl": "https://visit.varna.bg/media/cache/bf/2e//thumb2_wwm.jpg",
      "websiteUrl": "https://visit.varna.bg/bg/event/mnogoto-pateki-kam-morskata-istoriya-izlozhba.html",
      "isExternal": true,
      "createdAt": "2025-12-09T01:24:06.616Z",
      "creatorId": null,
      "tags": []
    },
    {
      "id": "varna_паролалюбовсемейноизложение_20251211",
      "title": "„Парола – Любов“ - семейно изложение",
      "description": "„Парола – Любов“ - семейно изложение 06 - 11.12.2025 г., 10:30 ч. Делта Планет Мол Академия за родители, уникални творения и... Събота, 06/12/2025г.-Четвъртък, 11/12/2025г.",
      "startDate": "2025-12-11T00:00:00.000Z",
      "endDate": "2025-12-11T00:00:00.000Z",
      "location": {
        "address": null,
        "city": "Варна",
        "country": "България",
        "coordinates": null
      },
      "category": "Деца",
      "price": 0,
      "isOnline": false,
      "imageUrl": "https://visit.varna.bg/media/cache/c3/6f//thumb2_576457.jpg",
      "websiteUrl": "https://visit.varna.bg/bg/event/parola-lyubov-semeyno-izlozhenie.html",
      "isExternal": true,
      "createdAt": "2025-12-09T01:24:06.616Z",
      "creatorId": null,
      "tags": []
    },
    {
      "id": "varna_коледенбазаррайонмладост_20251228",
      "title": "Коледен базаР - район Младост",
      "description": "Коледен базаР - район Младост 06.12 - 28.12.2025 г. Бивша циркова площадка, район Младост Коледният базар на район Мл... Събота, 06/12/2025г.-Неделя, 28/12/2025г.",
      "startDate": "2025-12-28T00:00:00.000Z",
      "endDate": "2025-12-28T00:00:00.000Z",
      "location": {
        "address": null,
        "city": "Варна",
        "country": "България",
        "coordinates": null
      },
      "category": "Култура",
      "price": 0,
      "isOnline": false,
      "imageUrl": "https://visit.varna.bg/media/cache/6a/e9//thumb2_bazar_mladost.jpg",
      "websiteUrl": "https://visit.varna.bg/bg/event/koleden-bazar-rayon-mladost.html",
      "isExternal": true,
      "createdAt": "2025-12-09T01:24:06.616Z",
      "creatorId": null,
      "tags": []
    },
    {
      "id": "varna_аладинконцертвкостюми_20251208",
      "title": "„Аладин\" - Концерт в костюми",
      "description": "„Аладин\" - Концерт в костюми 08.12.2025 г. и 09.12.2025 г., 19:00 ч. Държавна опера Варна, Основна сцена Музика: Алъ... Понеделник, 08/12/2025г.-Вторник, 09/12/2025г.",
      "startDate": "2025-12-08T00:00:00.000Z",
      "endDate": "2025-12-09T00:00:00.000Z",
      "location": {
        "address": "„Аладин\" - Концерт в костюми 08",
        "city": "Варна",
        "country": "България",
        "coordinates": null
      },
      "category": "Култура",
      "price": 0,
      "isOnline": false,
      "imageUrl": "https://visit.varna.bg/media/cache/ea/9d//thumb2_Alladin.jpg",
      "websiteUrl": "https://visit.varna.bg/bg/event/aladin-kontsert-v-kostyumi1225.html",
      "isExternal": true,
      "createdAt": "2025-12-09T01:24:06.616Z",
      "creatorId": null,
      "tags": []
    },
    {
      "id": "varna_хитърпетъринастрадинходжаспаси_20251209",
      "title": "\"Хитър Петър и Настрадин Ходжа, спасители на съвременна България\" - театрална постановка",
      "description": "\"Хитър Петър и Настрадин Ходжа, спасители на съвременна България\" - театрална постановка 09.12.2025г., 19:00ч. Зала \"Славейков\", Кв.\"Вл. Варненчик\" Режисьор... Вторник, 09/12/2025г.",
      "startDate": "2025-12-09T00:00:00.000Z",
      "endDate": "2025-12-09T00:00:00.000Z",
      "location": {
        "address": "\"Хитър Петър и Настрадин Ходжа",
        "city": "Варна",
        "country": "България",
        "coordinates": null
      },
      "category": "Култура",
      "price": 0,
      "isOnline": false,
      "imageUrl": "https://visit.varna.bg/media/cache/f3/e8//thumb2_3333.jpg",
      "websiteUrl": "https://visit.varna.bg/bg/event/hitar-petar-i-nastradin-hodzha-spasiteli-na-savrem.html",
      "isExternal": true,
      "createdAt": "2025-12-09T01:24:06.616Z",
      "creatorId": null,
      "tags": []
    },
    {
      "id": "varna_adiosгнминистъртеатралнапостан_20251209",
      "title": "„Adios, г-н Министър“ - театрална постановка",
      "description": "„Adios, г-н Министър“ - театрална постановка 09.12.2025 г., 19:00 ч. Фестивален и конгресен център Варна / Зала 1 &bdquo;Adios... Вторник, 09/12/2025г.",
      "startDate": "2025-12-09T00:00:00.000Z",
      "endDate": "2025-12-09T00:00:00.000Z",
      "location": {
        "address": "„Adios",
        "city": "Варна",
        "country": "България",
        "coordinates": null
      },
      "category": "Култура",
      "price": 0,
      "isOnline": false,
      "imageUrl": "https://visit.varna.bg/media/cache/38/25//thumb2_8585.jpg",
      "websiteUrl": "https://visit.varna.bg/bg/event/adios-g-n-ministar-teatralna-postanovka.html",
      "isExternal": true,
      "createdAt": "2025-12-09T01:24:06.617Z",
      "creatorId": null,
      "tags": []
    },
    {
      "id": "varna_насемействотослюбовконцертизпо_20251209",
      "title": "„На семейството с любов“ - концерт-изповед на Яница Кънева",
      "description": "„На семейството с любов“ - концерт-изповед на Яница Кънева 09.12.2025 г., 18:00 ч. и 20:00 ч. Фестивален и конгресен център Музикален моноспектакъ... Вторник, 09/12/2025г.",
      "startDate": "2025-12-09T00:00:00.000Z",
      "endDate": "2025-12-09T00:00:00.000Z",
      "location": {
        "address": "„На семейството с любов“ - концерт-изповед на Яница Кънева 09",
        "city": "Варна",
        "country": "България",
        "coordinates": null
      },
      "category": "Култура",
      "price": 0,
      "isOnline": false,
      "imageUrl": "https://visit.varna.bg/media/cache/9a/14//thumb2_yanitsa.jpg",
      "websiteUrl": "https://visit.varna.bg/bg/event/na-semeystvoto-s-lyubov-kontsert-izpoved-na-yanits.html",
      "isExternal": true,
      "createdAt": "2025-12-09T01:24:06.617Z",
      "creatorId": null,
      "tags": []
    },
    {
      "id": "varna_завойнаправоимпровизационношоу_20251209",
      "title": "„Завой Направо” - импровизационно шоу",
      "description": "„Завой Направо” - импровизационно шоу 09.12.2025г., 20:00ч. Варна, зала &bdquo;Щурче\", ул.Ангел Кънчев 33А Импровизации ... Вторник, 09/12/2025г.",
      "startDate": "2025-12-09T00:00:00.000Z",
      "endDate": "2025-12-09T00:00:00.000Z",
      "location": {
        "address": "„Завой Направо” - импровизационно шоу 09",
        "city": "Варна",
        "country": "България",
        "coordinates": null
      },
      "category": "Култура",
      "price": 0,
      "isOnline": false,
      "imageUrl": "https://visit.varna.bg/media/cache/06/0b//thumb2_58732068_n.jpg",
      "websiteUrl": "https://visit.varna.bg/bg/event/zavoy-napravo-improvizatsionno-shou.html",
      "isExternal": true,
      "createdAt": "2025-12-09T01:24:06.617Z",
      "creatorId": null,
      "tags": []
    },
    {
      "id": "varna_запознаймесвашитетеатралнапост_20251210",
      "title": "„Запознай ме с вашите“ - театрална постановка",
      "description": "„Запознай ме с вашите“ - театрална постановка 10.12.2025 г., 19:00 ч. Фестивален и конгресен център Варна / Зала 1 &bdquo;Запознай ме... Сряда, 10/12/2025г.",
      "startDate": "2025-12-10T00:00:00.000Z",
      "endDate": "2025-12-10T00:00:00.000Z",
      "location": {
        "address": "„Запознай ме с вашите“ - театрална постановка 10",
        "city": "Варна",
        "country": "България",
        "coordinates": null
      },
      "category": "Култура",
      "price": 0,
      "isOnline": false,
      "imageUrl": "https://visit.varna.bg/media/cache/7b/eb//thumb2_5855.jpg",
      "websiteUrl": "https://visit.varna.bg/bg/event/zapoznay-me-s-vashite-teatraln.html",
      "isExternal": true,
      "createdAt": "2025-12-09T01:24:08.173Z",
      "creatorId": null,
      "tags": []
    },
    {
      "id": "varna_magicshowmario_20251210",
      "title": "Magic Show Mario",
      "description": "Magic Show Mario 10.12.2025 г., 15:00 и 19:00 ч. Фестивален и конгресен център - Зала 2 Комедийно шоу с ... Сряда, 10/12/2025г.",
      "startDate": "2025-12-10T00:00:00.000Z",
      "endDate": "2025-12-10T00:00:00.000Z",
      "location": {
        "address": "Magic Show Mario 10",
        "city": "Варна",
        "country": "България",
        "coordinates": null
      },
      "category": "Култура",
      "price": 0,
      "isOnline": false,
      "imageUrl": "https://visit.varna.bg/media/cache/c3/78//thumb2_58902129_n.jpg",
      "websiteUrl": "https://visit.varna.bg/bg/event/magic-show-mario.html",
      "isExternal": true,
      "createdAt": "2025-12-09T01:24:08.173Z",
      "creatorId": null,
      "tags": []
    },
    {
      "id": "varna_фолклоренколеденпразникдрянови_20251211",
      "title": "Фолклорен коледен празник „Дряновица“",
      "description": "Фолклорен коледен празник „Дряновица“ 11.12.2025г., 10:00 ч. Фестивален и конгресен център Варна В навечерието на Рождеств... Четвъртък, 11/12/2025г.",
      "startDate": "2025-12-11T00:00:00.000Z",
      "endDate": "2025-12-11T00:00:00.000Z",
      "location": {
        "address": "Фолклорен коледен празник „Дряновица“ 11",
        "city": "Варна",
        "country": "България",
        "coordinates": null
      },
      "category": "Култура",
      "price": 0,
      "isOnline": false,
      "imageUrl": "https://visit.varna.bg/media/cache/e2/09//thumb2_Dryanovitsa_2.jpg",
      "websiteUrl": "https://visit.varna.bg/bg/event/folkloren-koleden-praznik-dryanovitsa.html",
      "isExternal": true,
      "createdAt": "2025-12-09T01:24:08.173Z",
      "creatorId": null,
      "tags": []
    },
    {
      "id": "varna_бракпоспешносттеатралнапостано_20251211",
      "title": "„Брак по спешност“ - театрална постановка",
      "description": "„Брак по спешност“ - театрална постановка 11.12.2025 г., 19:00 ч. Зала &bdquo;Славейков&ldquo;, Кв.&bdquo;Вл. Варненчик&ldquo; &b... Четвъртък, 11/12/2025г.",
      "startDate": "2025-12-11T00:00:00.000Z",
      "endDate": "2025-12-11T00:00:00.000Z",
      "location": {
        "address": "„Брак по спешност“ - театрална постановка 11",
        "city": "Варна",
        "country": "България",
        "coordinates": null
      },
      "category": "Култура",
      "price": 0,
      "isOnline": false,
      "imageUrl": "https://visit.varna.bg/media/cache/83/03//thumb2_56545.jpg",
      "websiteUrl": "https://visit.varna.bg/bg/event/brak-po-speshnost-teatralna.html",
      "isExternal": true,
      "createdAt": "2025-12-09T01:24:08.174Z",
      "creatorId": null,
      "tags": []
    },
    {
      "id": "varna_коледенафишнчпросвета1927_20251211",
      "title": "Коледен афиш - НЧ „Просвета 1927“",
      "description": "Коледен афиш - НЧ „Просвета 1927“ 11.12.2025 - 18.12.2025 г. НЧ &bdquo;Просвета 1927&ldquo;, Варна Програма: ... Четвъртък, 11/12/2025г.-Четвъртък, 18/12/2025г.",
      "startDate": "2025-12-11T00:00:00.000Z",
      "endDate": "2025-12-18T00:00:00.000Z",
      "location": {
        "address": null,
        "city": "Варна",
        "country": "България",
        "coordinates": null
      },
      "category": "Култура",
      "price": 0,
      "isOnline": false,
      "imageUrl": "https://visit.varna.bg/media/cache/d6/34//thumb2_asparuhovo.jpg",
      "websiteUrl": "https://visit.varna.bg/bg/event/koleden-afish-nch-prosveta-1927.html",
      "isExternal": true,
      "createdAt": "2025-12-09T01:24:08.174Z",
      "creatorId": null,
      "tags": []
    },
    {
      "id": "varna_представяненакнигатаотдълбокад_20251211",
      "title": "Представяне на книгата „От дълбока древност\" на Хенрик Сенкевич в нова светлина",
      "description": "Представяне на книгата „От дълбока древност\" на Хенрик Сенкевич в нова светлина 11.12.2025 г., 18:00 ч. Регионалната библиотека &bdquo; Пенчо Славейков&ldquo; Превода... Четвъртък, 11/12/2025г.",
      "startDate": "2025-12-11T00:00:00.000Z",
      "endDate": "2025-12-11T00:00:00.000Z",
      "location": {
        "address": null,
        "city": "Варна",
        "country": "България",
        "coordinates": null
      },
      "category": "Култура",
      "price": 0,
      "isOnline": false,
      "imageUrl": "https://visit.varna.bg/media/cache/8d/c6//thumb2_Senkiewicz.jpg",
      "websiteUrl": "https://visit.varna.bg/bg/event/predstavyane-na-knigata-ot-dalboka-drevnost-na-hen.html",
      "isExternal": true,
      "createdAt": "2025-12-09T01:24:08.174Z",
      "creatorId": null,
      "tags": []
    },
    {
      "id": "varna_муаутупантеатралнапостановка_20251212",
      "title": "„Муа у тупан“ - театрална постановка",
      "description": "„Муа у тупан“ - театрална постановка 12.12.2025 г., 19:00 ч. Драматичен театър &bdquo;Стоян Бъчваров&ldquo; - Сцена &bdquo;Ф... Петък, 12/12/2025г.",
      "startDate": "2025-12-12T00:00:00.000Z",
      "endDate": "2025-12-12T00:00:00.000Z",
      "location": {
        "address": "„Муа у тупан“ - театрална постановка 12",
        "city": "Варна",
        "country": "България",
        "coordinates": null
      },
      "category": "Култура",
      "price": 0,
      "isOnline": false,
      "imageUrl": "https://visit.varna.bg/media/cache/66/87//thumb2_65.jpg",
      "websiteUrl": "https://visit.varna.bg/bg/event/mua-u-tupan-teatralna.html",
      "isExternal": true,
      "createdAt": "2025-12-09T01:24:08.174Z",
      "creatorId": null,
      "tags": []
    },
    {
      "id": "varna_коледенюбилеенконцертначиталищ",
      "title": "Коледен юбилеен концерт на Читалище „Васил Левски 1945“ – Варна",
      "description": "Коледен юбилеен концерт на Читалище „Васил Левски 1945“ – Варна 12 декември 2025 г. (петък), 18:00 ч. Аула на Икономически университет &ndash; Варна В ... Петък, 12/12/2025г.",
      "startDate": "2025-12-09T01:24:08.174Z",
      "endDate": "2025-12-09T01:24:08.174Z",
      "location": {
        "address": null,
        "city": "Варна",
        "country": "България",
        "coordinates": null
      },
      "category": "Култура",
      "price": 0,
      "isOnline": false,
      "imageUrl": "https://visit.varna.bg/media/cache/f0/4f//thumb2_Christmas_festive_concert.jpg",
      "websiteUrl": "https://visit.varna.bg/bg/event/koleden-yubileen-kontsert-na-chitalishte-vasil-lev.html",
      "isExternal": true,
      "createdAt": "2025-12-09T01:24:08.174Z",
      "creatorId": null,
      "tags": []
    },
    {
      "id": "varna_изложбанадосидимчовскиосакадос_20251212",
      "title": "Изложба на Доси Димчовски – Осакадосака",
      "description": "Изложба на Доси Димчовски – Осакадосака 12.12.2025 - 09.01.2026 г. Галерия 33, Варна 9000, ул. Габрово 2А Галерия 33 предс... Петък, 12/12/2025г.-Петък, 09/01/2026г.",
      "startDate": "2025-12-12T00:00:00.000Z",
      "endDate": "2026-01-09T00:00:00.000Z",
      "location": {
        "address": "Изложба на Доси Димчовски – Осакадосака 12",
        "city": "Варна",
        "country": "България",
        "coordinates": null
      },
      "category": "Култура",
      "price": 0,
      "isOnline": false,
      "imageUrl": "https://visit.varna.bg/media/cache/d4/dd//thumb2_Vertical_Poster_Osakadosaka.jpg",
      "websiteUrl": "https://visit.varna.bg/bg/event/izlozhba-na-dosi-dimchovski-osakadosaka.html",
      "isExternal": true,
      "createdAt": "2025-12-09T01:24:08.175Z",
      "creatorId": null,
      "tags": []
    },
    {
      "id": "varna_коледенартфестивалсръчко_20251228",
      "title": "Коледен арт фестивал „Сръчко“",
      "description": "Коледен арт фестивал „Сръчко“ 12.12 - 28.12.2025 г., 10:00 - 20:00 ч. Delta Planet Mall Над 50 варненски майстори на ... Петък, 12/12/2025г.-Неделя, 28/12/2025г.",
      "startDate": "2025-12-28T00:00:00.000Z",
      "endDate": "2025-12-28T00:00:00.000Z",
      "location": {
        "address": null,
        "city": "Варна",
        "country": "България",
        "coordinates": null
      },
      "category": "Култура",
      "price": 0,
      "isOnline": false,
      "imageUrl": "https://visit.varna.bg/media/cache/3a/50//thumb2_srachko.jpg",
      "websiteUrl": "https://visit.varna.bg/bg/event/koleden-art-festival-srachko_2025.html",
      "isExternal": true,
      "createdAt": "2025-12-09T01:24:08.175Z",
      "creatorId": null,
      "tags": []
    },
    {
      "id": "varna_коледнагоричкааспарухово",
      "title": "Коледна Горичка Аспарухово",
      "description": "Коледна Горичка Аспарухово 12 - 28.12. 2025 г. Парк Аспарухово парк (до футболните игрища) Коледна Горичка Ас... Петък, 12/12/2025г.-Неделя, 28/12/2025г.",
      "startDate": "2025-12-09T01:24:08.175Z",
      "endDate": "2025-12-09T01:24:08.175Z",
      "location": {
        "address": null,
        "city": "Варна",
        "country": "България",
        "coordinates": null
      },
      "category": "Култура",
      "price": 0,
      "isOnline": false,
      "imageUrl": "https://visit.varna.bg/media/cache/a2/4e//thumb2_Christmas.jpg",
      "websiteUrl": "https://visit.varna.bg/bg/event/koledna-gorichka-asparuhovo.html",
      "isExternal": true,
      "createdAt": "2025-12-09T01:24:08.175Z",
      "creatorId": null,
      "tags": []
    },
    {
      "id": "varna_xxviiнационаленконкурспразникн_20251214",
      "title": "XXVII Национален конкурс „Празник на танца“",
      "description": "XXVII Национален конкурс „Празник на танца“ 13.12 - 14.12.2025г. Зала Конгресна - Дворец на културата и спорта В конкурса мог... Събота, 13/12/2025г.-Неделя, 14/12/2025г.",
      "startDate": "2025-12-14T00:00:00.000Z",
      "endDate": "2025-12-14T00:00:00.000Z",
      "location": {
        "address": "XXVII Национален конкурс „Празник на танца“ 13",
        "city": "Варна",
        "country": "България",
        "coordinates": null
      },
      "category": "Спорт",
      "price": 0,
      "isOnline": false,
      "imageUrl": "https://visit.varna.bg/media/cache/e1/f2//thumb2_541345793_11938_n.jpg",
      "websiteUrl": "https://visit.varna.bg/bg/event/xxvi-natsionalen-konkurs-praznik-na-tantsa.html",
      "isExternal": true,
      "createdAt": "2025-12-09T01:24:08.175Z",
      "creatorId": null,
      "tags": []
    },
    {
      "id": "varna_сестраанжеликаиселскачестопера_20251213",
      "title": "„Сестра Анжелика“ и „Селска чест“ -  опера",
      "description": "„Сестра Анжелика“ и „Селска чест“ - опера 13.12.2025 г., 19:00 ч. Държавна опера Варна &bdquo;Сестра ��нжелика&ldquo; Едно... Събота, 13/12/2025г.",
      "startDate": "2025-12-13T00:00:00.000Z",
      "endDate": "2025-12-13T00:00:00.000Z",
      "location": {
        "address": "„Сестра Анжелика“ и „Селска чест“ - опера 13",
        "city": "Варна",
        "country": "България",
        "coordinates": null
      },
      "category": "Култура",
      "price": 0,
      "isOnline": false,
      "imageUrl": "https://visit.varna.bg/media/cache/b5/56//thumb2_444.jpg",
      "websiteUrl": "https://visit.varna.bg/bg/event/sestra-anzhelika-i-selska-chest-opera.html",
      "isExternal": true,
      "createdAt": "2025-12-09T01:24:09.742Z",
      "creatorId": null,
      "tags": []
    },
    {
      "id": "varna_щафетноколеднокарнавалнобягане_20251213",
      "title": "Щафетно, коледно, карнавално бягане - спортно състезание",
      "description": "Щафетно, коледно, карнавално бягане - спортно състезание 13.12.2025 г., 9:00 ч. Слънчев Часовник / Морска градина Коледа приближава, включ... Събота, 13/12/2025г.",
      "startDate": "2025-12-13T00:00:00.000Z",
      "endDate": "2025-12-13T00:00:00.000Z",
      "location": {
        "address": null,
        "city": "Варна",
        "country": "България",
        "coordinates": null
      },
      "category": "Спорт",
      "price": 0,
      "isOnline": false,
      "imageUrl": "https://visit.varna.bg/media/cache/b4/0e//thumb2_35645.jpg",
      "websiteUrl": "https://visit.varna.bg/bg/event/shtafetno-koledno-karnavalno-byagan-sportno-sastez.html",
      "isExternal": true,
      "createdAt": "2025-12-09T01:24:09.742Z",
      "creatorId": null,
      "tags": []
    },
    {
      "id": "varna_коледнипредставлениянадържавен_20251221",
      "title": "Коледни представления на Държавен куклен театър Варна",
      "description": "Коледни представления на Държавен куклен театър Варна 13.12 - 21.12.2025 г. Държавен куклен театър Варна Коледни представления в Държавен кук... Събота, 13/12/2025г.-Неделя, 21/12/2025г.",
      "startDate": "2025-12-21T00:00:00.000Z",
      "endDate": "2025-12-21T00:00:00.000Z",
      "location": {
        "address": "Коледни представления на Държавен куклен театър Варна 13",
        "city": "Варна",
        "country": "България",
        "coordinates": null
      },
      "category": "Култура",
      "price": 0,
      "isOnline": false,
      "imageUrl": "https://visit.varna.bg/media/cache/61/72//thumb2_kuklen_teatyr.jpg",
      "websiteUrl": "https://visit.varna.bg/bg/event/koledni-predstavleniya-na-darzhaven-kuklen-teatar-.html",
      "isExternal": true,
      "createdAt": "2025-12-09T01:24:09.743Z",
      "creatorId": null,
      "tags": []
    },
    {
      "id": "varna_годишенконцертнануидобрихристо_20251214",
      "title": "Годишен концерт на НУИ „Добри Христов“",
      "description": "Годишен концерт на НУИ „Добри Христов“ 14.12.2025 г., 18:00 ч. Фестивален и конгресен център Галаконцерт &bdquo;Традиция... Неделя, 14/12/2025г.",
      "startDate": "2025-12-14T00:00:00.000Z",
      "endDate": "2025-12-14T00:00:00.000Z",
      "location": {
        "address": "Годишен концерт на НУИ „Добри Христов“ 14",
        "city": "Варна",
        "country": "България",
        "coordinates": null
      },
      "category": "Култура",
      "price": 0,
      "isOnline": false,
      "imageUrl": "https://visit.varna.bg/media/cache/98/ac//thumb2_usic.jpg",
      "websiteUrl": "https://visit.varna.bg/bg/event/godishen-kontsert-na-nui-dobri-hristov_2025.html",
      "isExternal": true,
      "createdAt": "2025-12-09T01:24:09.743Z",
      "creatorId": null,
      "tags": []
    },
    {
      "id": "varna_безплатнипредставлениявделфина_20251214",
      "title": "Безплатни представления в Делфинариум Варна",
      "description": "Безплатни представления в Делфинариум Варна 14.12.2025 г. Делфинариум Варна Делфинариум Варна ще зарадва децата с безплатни предста... Неделя, 14/12/2025г.",
      "startDate": "2025-12-14T00:00:00.000Z",
      "endDate": "2025-12-14T00:00:00.000Z",
      "location": {
        "address": null,
        "city": "Варна",
        "country": "България",
        "coordinates": null
      },
      "category": "Деца",
      "price": 0,
      "isOnline": false,
      "imageUrl": "https://visit.varna.bg/media/cache/e5/b9//thumb2_DSC_2369.jpg",
      "websiteUrl": "https://visit.varna.bg/bg/event/bezplatni-predstavleniya-v-delfinarium-varna.html",
      "isExternal": true,
      "createdAt": "2025-12-09T01:24:09.743Z",
      "creatorId": null,
      "tags": []
    },
    {
      "id": "varna_виенашьонбруноркестраколеденко_20251215",
      "title": "„Виена Шьонбрун Оркестра“ - коледен концерт",
      "description": "„Виена Шьонбрун Оркестра“ - коледен концерт 15.12.2025г., 19:00ч. Дворец на Културата и Спорта И тази година празничният д... Понеделник, 15/12/2025г.",
      "startDate": "2025-12-15T00:00:00.000Z",
      "endDate": "2025-12-15T00:00:00.000Z",
      "location": {
        "address": null,
        "city": "Варна",
        "country": "България",
        "coordinates": null
      },
      "category": "Култура",
      "price": 0,
      "isOnline": false,
      "imageUrl": "https://visit.varna.bg/media/cache/07/54//thumb2_555.jpg",
      "websiteUrl": "https://visit.varna.bg/bg/event/viena-shyonbrun-orkestra-koleden-kontsert.html",
      "isExternal": true,
      "createdAt": "2025-12-09T01:24:09.743Z",
      "creatorId": null,
      "tags": []
    },
    {
      "id": "varna_сиранодьобержерактеатралнапост_20251215",
      "title": "„Сирано дьо Бержерак“ - театрална постановка",
      "description": "„Сирано дьо Бержерак“ - театрална постановка 15.12.2025 г., 19:00 ч. Фестивален и конгресен център Варна / Зала 1 &bdquo;Сиран... Понеделник, 15/12/2025г.",
      "startDate": "2025-12-15T00:00:00.000Z",
      "endDate": "2025-12-15T00:00:00.000Z",
      "location": {
        "address": "„Сирано дьо Бержерак“ - театрална постановка 15",
        "city": "Варна",
        "country": "България",
        "coordinates": null
      },
      "category": "Култура",
      "price": 0,
      "isOnline": false,
      "imageUrl": "https://visit.varna.bg/media/cache/de/e9//thumb2_6969.jpg",
      "websiteUrl": "https://visit.varna.bg/bg/event/sirano-dyo-berzherak-teatralna-postanovka.html",
      "isExternal": true,
      "createdAt": "2025-12-09T01:24:09.744Z",
      "creatorId": null,
      "tags": []
    },
    {
      "id": "varna_лешникотрошачкатабалет_20251215",
      "title": "„Лешникотрошачката“  - балет",
      "description": "„Лешникотрошачката“ - балет 15.12.2025 г., 19:00 ч. Държавна опера Варна, сцена Филиал Балет от П. И. Чайковски ... Понеделник, 15/12/2025г.",
      "startDate": "2025-12-15T00:00:00.000Z",
      "endDate": "2025-12-15T00:00:00.000Z",
      "location": {
        "address": "„Лешникотрошачката“ - балет 15",
        "city": "Варна",
        "country": "България",
        "coordinates": null
      },
      "category": "Култура",
      "price": 0,
      "isOnline": false,
      "imageUrl": "https://visit.varna.bg/media/cache/53/99//thumb2_e_7a2aeea1165d.jpg",
      "websiteUrl": "https://visit.varna.bg/bg/event/leshnikotroshachkata-balet151225.html",
      "isExternal": true,
      "createdAt": "2025-12-09T01:24:09.744Z",
      "creatorId": null,
      "tags": []
    },
    {
      "id": "varna_любовнамагияконцерт_20251215",
      "title": "„Любовна магия“ - концерт",
      "description": "„Любовна магия“ - концерт 15.12.2025 г., 19:30 ч. Фестивален и конгресен център Симфониета &bdquo;Видин&ldq... Понеделник, 15/12/2025г.",
      "startDate": "2025-12-15T00:00:00.000Z",
      "endDate": "2025-12-15T00:00:00.000Z",
      "location": {
        "address": "„Любовна магия“ - концерт 15",
        "city": "Варна",
        "country": "България",
        "coordinates": null
      },
      "category": "Култура",
      "price": 0,
      "isOnline": false,
      "imageUrl": "https://visit.varna.bg/media/cache/dd/11//thumb2_agic.jpg",
      "websiteUrl": "https://visit.varna.bg/bg/event/lyubovna-magiya-kontsert_2025.html",
      "isExternal": true,
      "createdAt": "2025-12-09T01:24:09.744Z",
      "creatorId": null,
      "tags": []
    },
    {
      "id": "varna_големиятфиналнамеждузвезднотот_20251216",
      "title": "\"Големият финал на междузвездното турне на Шкумбата\" - комедиен спектакъл",
      "description": "\"Големият финал на междузвездното турне на Шкумбата\" - комедиен спектакъл 16.12.2025г., 19:00ч. Дворец на културата и спорта ГОЛЕМИЯТ ФИНАЛ НА МЕЖДУЗВЕ... Вторник, 16/12/2025г.",
      "startDate": "2025-12-16T00:00:00.000Z",
      "endDate": "2025-12-16T00:00:00.000Z",
      "location": {
        "address": null,
        "city": "Варна",
        "country": "България",
        "coordinates": null
      },
      "category": "Култура",
      "price": 0,
      "isOnline": false,
      "imageUrl": "https://visit.varna.bg/media/cache/c0/aa//thumb2_11.jpg",
      "websiteUrl": "https://visit.varna.bg/bg/event/golemiya-final-na-mezhduzvezdnoto-turne-na-shkumba.html",
      "isExternal": true,
      "createdAt": "2025-12-09T01:24:09.744Z",
      "creatorId": null,
      "tags": []
    },
    {
      "id": "varna_иверниятотговоретеатралнапоста_20251216",
      "title": "„И верният отговор е...“ - театрална постановка",
      "description": "„И верният отговор е...“ - театрална постановка 16.12.2025 г., 19:00 ч. Фестивален и конгресен център Варна / Зала 1 &bdquo;И вер... Вторник, 16/12/2025г.",
      "startDate": "2025-12-16T00:00:00.000Z",
      "endDate": "2025-12-16T00:00:00.000Z",
      "location": {
        "address": "„И верният отговор е",
        "city": "Варна",
        "country": "България",
        "coordinates": null
      },
      "category": "Култура",
      "price": 0,
      "isOnline": false,
      "imageUrl": "https://visit.varna.bg/media/cache/53/62//thumb2_6434.jpg",
      "websiteUrl": "https://visit.varna.bg/bg/event/i-verniyat-otgovor-e-teatralna.html",
      "isExternal": true,
      "createdAt": "2025-12-09T01:24:09.744Z",
      "creatorId": null,
      "tags": []
    },
    {
      "id": "varna_коледниприключенияопаснисъсгер_20251217",
      "title": "Коледни „Приключения опасни със герои сладкогласни“ - спектакъл",
      "description": "Коледни „Приключения опасни със герои сладкогласни“ - спектакъл 17.12.2025 - 22.12.2025 г. ДТ &bdquo;Ст.Бъчваров&ldquo; Варна, Сцена филиал Поредица... Сряда, 17/12/2025г.-Понеделник, 22/12/2025г.",
      "startDate": "2025-12-17T00:00:00.000Z",
      "endDate": "2025-12-22T00:00:00.000Z",
      "location": {
        "address": null,
        "city": "Варна",
        "country": "България",
        "coordinates": null
      },
      "category": "Култура",
      "price": 0,
      "isOnline": false,
      "imageUrl": "https://visit.varna.bg/media/cache/a3/46//thumb2_koledni-priklyucheniya-opasni.jpg",
      "websiteUrl": "https://visit.varna.bg/bg/event/koledni-priklyucheniya-opasni-sas-geroi-sladkoglas.html",
      "isExternal": true,
      "createdAt": "2025-12-09T01:24:09.744Z",
      "creatorId": null,
      "tags": []
    },
    {
      "id": "varna_севилскиятбръснаропера_20251217",
      "title": "„Севилският бръснар“ - опера",
      "description": "„Севилският бръснар“ - опера 17.12.2025 г., 19:00 ч. Държавна опера Варна, Основна сцена Oпера от Джоакино Росини ... Сряда, 17/12/2025г.",
      "startDate": "2025-12-17T00:00:00.000Z",
      "endDate": "2025-12-17T00:00:00.000Z",
      "location": {
        "address": "„Севилският бръснар“ - опера 17",
        "city": "Варна",
        "country": "България",
        "coordinates": null
      },
      "category": "Култура",
      "price": 0,
      "isOnline": false,
      "imageUrl": "https://visit.varna.bg/media/cache/a0/ef//thumb2_e_19da82ec6ef2817e03383.jpg",
      "websiteUrl": "https://visit.varna.bg/bg/event/sevilskiyat-brasnar-opera171225.html",
      "isExternal": true,
      "createdAt": "2025-12-09T01:24:11.218Z",
      "creatorId": null,
      "tags": []
    },
    {
      "id": "varna_присмехулницитеатралнапостанов_20251218",
      "title": "„Присмехулници“ - театрална постановка",
      "description": "„Присмехулници“ - театрална постановка 18.12.2025 г., 19:00 ч. Фестивален и конгресен център Варна / Зала 1 &bdquo;Присмехулни... Четвъртък, 18/12/2025г.",
      "startDate": "2025-12-18T00:00:00.000Z",
      "endDate": "2025-12-18T00:00:00.000Z",
      "location": {
        "address": "„Присмехулници“ - театрална постановка 18",
        "city": "Варна",
        "country": "България",
        "coordinates": null
      },
      "category": "Култура",
      "price": 0,
      "isOnline": false,
      "imageUrl": "https://visit.varna.bg/media/cache/c9/64//thumb2_8686.jpg",
      "websiteUrl": "https://visit.varna.bg/bg/event/presmehulnitsi-teatralna-postanovka.html",
      "isExternal": true,
      "createdAt": "2025-12-09T01:24:11.218Z",
      "creatorId": null,
      "tags": []
    },
    {
      "id": "varna_коледнафолклорнафеерия_20251218",
      "title": "Коледна фолклорна феерия",
      "description": "Коледна фолклорна феерия 18.12.2025 г. - 19.12.2025 г. Дворец на културата и спорта - Варна Програма: 18... Четвъртък, 18/12/2025г.",
      "startDate": "2025-12-18T00:00:00.000Z",
      "endDate": "2025-12-19T00:00:00.000Z",
      "location": {
        "address": null,
        "city": "Варна",
        "country": "България",
        "coordinates": null
      },
      "category": "Спорт",
      "price": 0,
      "isOnline": false,
      "imageUrl": "https://visit.varna.bg/media/cache/cb/11//thumb2_Christmas_folklore_feery.jpg",
      "websiteUrl": "https://visit.varna.bg/bg/event/koledna-folklorna-feeriya.html",
      "isExternal": true,
      "createdAt": "2025-12-09T01:24:11.218Z",
      "creatorId": null,
      "tags": []
    },
    {
      "id": "varna_коледенконцертнадетскихордобри_20251218",
      "title": "Коледен концерт на Детски хор „Добри Христов“",
      "description": "Коледен концерт на Детски хор „Добри Христов“ 18.12.2025 г., 18:30 ч. Градска художествена галерия &bdquo;Борис Георгиев&ldquo; - Варна ... Четвъртък, 18/12/2025г.",
      "startDate": "2025-12-18T00:00:00.000Z",
      "endDate": "2025-12-18T00:00:00.000Z",
      "location": {
        "address": "Коледен концерт на Детски хор „Добри Христов“ 18",
        "city": "Варна",
        "country": "България",
        "coordinates": null
      },
      "category": "Култура",
      "price": 0,
      "isOnline": false,
      "imageUrl": "https://visit.varna.bg/media/cache/40/81//thumb2_Christmas_concert.jpg",
      "websiteUrl": "https://visit.varna.bg/bg/event/koleden-kontsert-na-detski-hor-dobri-hristov.html",
      "isExternal": true,
      "createdAt": "2025-12-09T01:24:11.219Z",
      "creatorId": null,
      "tags": []
    },
    {
      "id": "varna_пепеляшкабалет_20251219",
      "title": "„Пепеляшка“ - балет",
      "description": "„Пепеляшка“ - балет 19.12.2025 г., 19:00 ч. Държавна опера Варна &bdquo;Пепеляшка&ldquo; - балет о... Петък, 19/12/2025г.",
      "startDate": "2025-12-19T00:00:00.000Z",
      "endDate": "2025-12-19T00:00:00.000Z",
      "location": {
        "address": "„Пепеляшка“ - балет 19",
        "city": "Варна",
        "country": "България",
        "coordinates": null
      },
      "category": "Култура",
      "price": 0,
      "isOnline": false,
      "imageUrl": "https://visit.varna.bg/media/cache/a0/a4//thumb2_Cinderella.jpg",
      "websiteUrl": "https://visit.varna.bg/bg/event/pepelyashka-balet2025.html",
      "isExternal": true,
      "createdAt": "2025-12-09T01:24:11.219Z",
      "creatorId": null,
      "tags": []
    },
    {
      "id": "varna_varnawinterfest2025_20251222",
      "title": "Varna Winter Fest 2025",
      "description": "Varna Winter Fest 2025 20 - 22.12.2025 Дворец на културата и спорта Варна Пилотното издание на многожанрови... Събота, 20/12/2025г.-Понеделник, 22/12/2025г.",
      "startDate": "2025-12-22T00:00:00.000Z",
      "endDate": "2025-12-22T00:00:00.000Z",
      "location": {
        "address": null,
        "city": "Варна",
        "country": "България",
        "coordinates": null
      },
      "category": "Спорт",
      "price": 0,
      "isOnline": false,
      "imageUrl": "https://visit.varna.bg/media/cache/4f/c0//thumb2_Varna_fest.jpg",
      "websiteUrl": "https://visit.varna.bg/bg/event/park-fest-2025.html",
      "isExternal": true,
      "createdAt": "2025-12-09T01:24:11.219Z",
      "creatorId": null,
      "tags": []
    },
    {
      "id": "varna_неколеденбазарсъбитие_20251221",
      "title": "„НеКоледен базар“ - събитие",
      "description": "„НеКоледен базар“ - събитие 20 и 21.12.2025 г., 11:00 - 19:00 ч. Хале 3 / бул. &bdquo;Христо Ботев&ldquo; 3 За поре... Събота, 20/12/2025г.-Неделя, 21/12/2025г.",
      "startDate": "2025-12-21T00:00:00.000Z",
      "endDate": "2025-12-21T00:00:00.000Z",
      "location": {
        "address": "„НеКоледен базар“ - събитие 20 и 21",
        "city": "Варна",
        "country": "България",
        "coordinates": null
      },
      "category": "Култура",
      "price": 0,
      "isOnline": false,
      "imageUrl": "https://visit.varna.bg/media/cache/6b/a4//thumb2_Non-Christmas_bazaar.jpg",
      "websiteUrl": "https://visit.varna.bg/bg/event/nekoleden-bazar-sabitie.html",
      "isExternal": true,
      "createdAt": "2025-12-09T01:24:11.219Z",
      "creatorId": null,
      "tags": []
    },
    {
      "id": "varna_бохемиопера_20251220",
      "title": "„Бохеми“ - опера",
      "description": "„Бохеми“ - опера 20.12.2025 г., 19:00 ч. Държавна опера Варна &bdquo;Бохеми&ldquo; - опера от Джакомо Пу... Събота, 20/12/2025��.",
      "startDate": "2025-12-20T00:00:00.000Z",
      "endDate": "2025-12-20T00:00:00.000Z",
      "location": {
        "address": "„Бохеми“ - опера 20",
        "city": "Варна",
        "country": "България",
        "coordinates": null
      },
      "category": "Култура",
      "price": 0,
      "isOnline": false,
      "imageUrl": "https://visit.varna.bg/media/cache/98/ae//thumb2_Bohemi.jpg",
      "websiteUrl": "https://visit.varna.bg/bg/event/bohemi-opera.html",
      "isExternal": true,
      "createdAt": "2025-12-09T01:24:11.219Z",
      "creatorId": null,
      "tags": []
    },
    {
      "id": "varna_малъкколеденфестивалнакуклите2_20251221",
      "title": "Малък Коледен Фестивал на Куклите 2025",
      "description": "Малък Коледен Фестивал на Куклите 2025 20 - 21.12.2025 г. Фестивален и Конгресен център Варна В навечерието на Коледа, един от... Събота, 20/12/2025г.",
      "startDate": "2025-12-21T00:00:00.000Z",
      "endDate": "2025-12-21T00:00:00.000Z",
      "location": {
        "address": "Малък Коледен Фестивал на Куклите 2025 20 - 21",
        "city": "Варна",
        "country": "България",
        "coordinates": null
      },
      "category": "Култура",
      "price": 0,
      "isOnline": false,
      "imageUrl": "https://visit.varna.bg/media/cache/70/b6//thumb2_christmas_festival_of_puppies.jpg",
      "websiteUrl": "https://visit.varna.bg/bg/event/malak-koleden-festival-na-kuklite-2025.html",
      "isExternal": true,
      "createdAt": "2025-12-09T01:24:11.220Z",
      "creatorId": null,
      "tags": []
    },
    {
      "id": "varna_коледнанощконцертнагеоргихрист_20251221",
      "title": "„Коледна нощ“ - концерт на Георги Христов",
      "description": "„Коледна нощ“ - концерт на Георги Христов 21.12.2025 г., 19:00 ч. Фестивален и конгресен център Варна / Зала 1 Потопете се в свят... Неделя, 21/12/2025г.",
      "startDate": "2025-12-21T00:00:00.000Z",
      "endDate": "2025-12-21T00:00:00.000Z",
      "location": {
        "address": "„Коледна нощ“ - концерт на Георги Христов 21",
        "city": "Варна",
        "country": "България",
        "coordinates": null
      },
      "category": "Култура",
      "price": 0,
      "isOnline": false,
      "imageUrl": "https://visit.varna.bg/media/cache/3f/82//thumb2_3322.jpg",
      "websiteUrl": "https://visit.varna.bg/bg/event/koledna-nosht-kontsert-na-georgi-hristov.html",
      "isExternal": true,
      "createdAt": "2025-12-09T01:24:11.220Z",
      "creatorId": null,
      "tags": []
    },
    {
      "id": "varna_даоцелеешпоколедастендъпшоу_20251222",
      "title": "„Да оцелееш по Коледа“ - стендъп шоу",
      "description": "„Да оцелееш по Коледа“ - стендъп шоу 22.12.2025 г., 19:00 ч. Фестивален и конгресен център Варна / Зала 1 \"Да оцелееш п... Понеделник, 22/12/2025г.",
      "startDate": "2025-12-22T00:00:00.000Z",
      "endDate": "2025-12-22T00:00:00.000Z",
      "location": {
        "address": "„Да оцелееш по Коледа“ - стендъп шоу 22",
        "city": "Варна",
        "country": "България",
        "coordinates": null
      },
      "category": "Култура",
      "price": 0,
      "isOnline": false,
      "imageUrl": "https://visit.varna.bg/media/cache/48/5c//thumb2_65455.jpg",
      "websiteUrl": "https://visit.varna.bg/bg/event/da-otseleesh-po-koleda-stendap-shou.html",
      "isExternal": true,
      "createdAt": "2025-12-09T01:24:11.220Z",
      "creatorId": null,
      "tags": []
    },
    {
      "id": "varna_тримакралемоноспектакъл_20251222",
      "title": "„Трима крале“ - моноспектакъл",
      "description": "„Трима крале“ - моноспектакъл 22.12.2025 г., 19:00 ч. Фестивален и конгресен център Варна / Зала 2 &bdquo;Трима крале... Понеделник, 22/12/2025г.",
      "startDate": "2025-12-22T00:00:00.000Z",
      "endDate": "2025-12-22T00:00:00.000Z",
      "location": {
        "address": "„Трима крале“ - моноспектакъл 22",
        "city": "Варна",
        "country": "България",
        "coordinates": null
      },
      "category": "Култура",
      "price": 0,
      "isOnline": false,
      "imageUrl": "https://visit.varna.bg/media/cache/98/82//thumb2_64.jpg",
      "websiteUrl": "https://visit.varna.bg/bg/event/trima-krale-monospektakal.html",
      "isExternal": true,
      "createdAt": "2025-12-09T01:24:11.220Z",
      "creatorId": null,
      "tags": []
    },
    {
      "id": "varna_щраусгала_20251223",
      "title": "Щраус гала",
      "description": "Щраус гала 23.12.2025 г., 19:00 ч. Държавна опера Варна, Основна сцена Щраус гала Дириг... Вторник, 23/12/2025г.",
      "startDate": "2025-12-23T00:00:00.000Z",
      "endDate": "2025-12-23T00:00:00.000Z",
      "location": {
        "address": "Щраус гала 23",
        "city": "Варна",
        "country": "България",
        "coordinates": null
      },
      "category": "Култура",
      "price": 0,
      "isOnline": false,
      "imageUrl": "https://visit.varna.bg/media/cache/f7/cb//thumb2_strauss_gala.jpg",
      "websiteUrl": "https://visit.varna.bg/bg/event/shtraus-gala_23_12_2025.html",
      "isExternal": true,
      "createdAt": "2025-12-09T01:24:12.852Z",
      "creatorId": null,
      "tags": []
    },
    {
      "id": "varna_празниченконцертпесниитанциотв_20251223",
      "title": "Празничен концерт „Песни и танци от Варненско\"",
      "description": "Празничен концерт „Песни и танци от Варненско\" 23.12.2025г.,18:30ч. Фестивален и Конгресен център Варна, Зала 1 В навечерието на Колед... Вторник, 23/12/2025г.",
      "startDate": "2025-12-23T00:00:00.000Z",
      "endDate": "2025-12-23T00:00:00.000Z",
      "location": {
        "address": "Празничен концерт „Песни и танци от Варненско\" 23",
        "city": "Варна",
        "country": "България",
        "coordinates": null
      },
      "category": "Култура",
      "price": 0,
      "isOnline": false,
      "imageUrl": "https://visit.varna.bg/media/cache/0a/11//thumb2_festive_concert.jpg",
      "websiteUrl": "https://visit.varna.bg/bg/event/praznichen-kontsert-pesni-i-tantsi-ot-varnensko.html",
      "isExternal": true,
      "createdAt": "2025-12-09T01:24:12.852Z",
      "creatorId": null,
      "tags": []
    },
    {
      "id": "varna_безплатенколеденпешеходентурна",
      "title": "Безплатен Коледен пешеходен тур на Варна",
      "description": "Безплатен Коледен пешеходен тур на Варна Дата: 27 декември 2025 (събота) Място и час на тръгване: 16:00 ч. пред... Събота, 27/12/2025г.",
      "startDate": "2025-12-09T01:24:12.852Z",
      "endDate": "2025-12-09T01:24:12.852Z",
      "location": {
        "address": null,
        "city": "Варна",
        "country": "България",
        "coordinates": null
      },
      "category": "Култура",
      "price": 0,
      "isOnline": false,
      "imageUrl": "https://visit.varna.bg/media/cache/54/f7//thumb2_YGY03654.jpg",
      "websiteUrl": "https://visit.varna.bg/bg/event/bezplaten-koleden-peshehoden-tur-na-varna.html",
      "isExternal": true,
      "createdAt": "2025-12-09T01:24:12.852Z",
      "creatorId": null,
      "tags": []
    },
    {
      "id": "varna_коледнаприказкасмаестройорданк_20251228",
      "title": "„Коледна Приказка“ с маестро Йордан Камджалов и Деси Тенекеджиева",
      "description": "„Коледна Приказка“ с маестро Йордан Камджалов и Деси Тенекеджиева 28.12.2025 г., 18:00 ч. и 20:00 ч. Фестивален и конгресен център След едногодишна пауза... Неделя, 28/12/2025г.",
      "startDate": "2025-12-28T00:00:00.000Z",
      "endDate": "2025-12-28T00:00:00.000Z",
      "location": {
        "address": "„Коледна Приказка“ с маестро Йордан Камджалов и Деси Тенекеджиева 28",
        "city": "Варна",
        "country": "България",
        "coordinates": null
      },
      "category": "Култура",
      "price": 0,
      "isOnline": false,
      "imageUrl": "https://visit.varna.bg/media/cache/8a/e8//thumb2_dessi.jpg",
      "websiteUrl": "https://visit.varna.bg/bg/event/koledna-prikazka-s-maestro-yordan-kamdzhalov-i-des.html",
      "isExternal": true,
      "createdAt": "2025-12-09T01:24:12.852Z",
      "creatorId": null,
      "tags": []
    },
    {
      "id": "varna_бялаколедапразниченконцертнапл_20251229",
      "title": "„Бяла Коледа“ - празничен концерт на Плевенската филхармония",
      "description": "„Бяла Коледа“ - празничен концерт на Плевенската филхармония 29.12.2025 г., 19:30 ч. Фестивален и конгресен център​ Празничен концерт на Плевенската... Понеделник, 29/12/2025г.",
      "startDate": "2025-12-29T00:00:00.000Z",
      "endDate": "2025-12-29T00:00:00.000Z",
      "location": {
        "address": "„Бяла Коледа“ - празничен концерт на Плевенската филхармония 29",
        "city": "Варна",
        "country": "България",
        "coordinates": null
      },
      "category": "Култура",
      "price": 0,
      "isOnline": false,
      "imageUrl": "https://visit.varna.bg/media/cache/1f/d3//thumb2_lucy.jpg",
      "websiteUrl": "https://visit.varna.bg/bg/event/byala-koleda-praznichen-kontsert-na-plevenskata-fi.html",
      "isExternal": true,
      "createdAt": "2025-12-09T01:24:12.853Z",
      "creatorId": null,
      "tags": []
    },
    {
      "id": "varna_лешникотрошачкатабалет_20251230",
      "title": "„Лешникотрошачката“ - балет",
      "description": "„Лешникотрошачката“ - балет 30.12.2025 г., 19:00 ч. Държавна опера Варна, Основна сцена Балет от П. И. Чайковски в ... Вторник, 30/12/2025г.",
      "startDate": "2025-12-30T00:00:00.000Z",
      "endDate": "2025-12-30T00:00:00.000Z",
      "location": {
        "address": "„Лешникотрошачката“ - балет 30",
        "city": "Варна",
        "country": "България",
        "coordinates": null
      },
      "category": "Култура",
      "price": 0,
      "isOnline": false,
      "imageUrl": "https://visit.varna.bg/media/cache/f8/1c//thumb2_nutcracker.jpg",
      "websiteUrl": "https://visit.varna.bg/bg/event/leshnikotroshachkata-balet_30_12_25.html",
      "isExternal": true,
      "createdAt": "2025-12-09T01:24:12.853Z",
      "creatorId": null,
      "tags": []
    },
    {
      "id": "varna_заедновновогодишнатанощпразнич_20251231",
      "title": "„Заедно в новогодишната нощ\" - празничен концерт",
      "description": "„Заедно в новогодишната нощ\" - празничен концерт 31.12.2025г. Площад &bdquo;Независимост&ldquo; Новогодишен концерт на площад &bdquo;Нез... Сряда, 31/12/2025г.",
      "startDate": "2025-12-31T00:00:00.000Z",
      "endDate": "2025-12-31T00:00:00.000Z",
      "location": {
        "address": null,
        "city": "Варна",
        "country": "България",
        "coordinates": null
      },
      "category": "Култура",
      "price": 0,
      "isOnline": false,
      "imageUrl": "https://visit.varna.bg/media/cache/d5/5a//thumb2_New_Year.jpg",
      "websiteUrl": "https://visit.varna.bg/bg/event/zaedno-v-novogodishnata-nosht-praznichen-kontsert.html",
      "isExternal": true,
      "createdAt": "2025-12-09T01:24:12.853Z",
      "creatorId": null,
      "tags": []
    },
    {
      "id": "varna_лешникотрошачкатабалет_20251231",
      "title": "„Лешникотрошачката“ - балет",
      "description": "„Лешникотрошачката“ - балет 31.12.2025 г., 17:00 ч. Държавна опера Варна, Основна сцена Балет от П. И. Чайковски в ... Сряда, 31/12/2025г.",
      "startDate": "2025-12-31T00:00:00.000Z",
      "endDate": "2025-12-31T00:00:00.000Z",
      "location": {
        "address": "„Лешникотрошачката“ - балет 31",
        "city": "Варна",
        "country": "България",
        "coordinates": null
      },
      "category": "Култура",
      "price": 0,
      "isOnline": false,
      "imageUrl": "https://visit.varna.bg/media/cache/f0/24//thumb2_nutcracker.jpg",
      "websiteUrl": "https://visit.varna.bg/bg/event/leshnikotroshachkata-balet_31_12_25.html",
      "isExternal": true,
      "createdAt": "2025-12-09T01:24:12.853Z",
      "creatorId": null,
      "tags": []
    },
    {
      "id": "varna_ревносттеатралнапостановка_20260119",
      "title": "„Ревност“ - театрална постановка",
      "description": "„Ревност“ - театрална постановка 19.01.2026 г., 19:00 ч. Фестивален и конгресен център Варна, Зала 1 &bdquo;... Понеделник, 19/01/2026г.",
      "startDate": "2026-01-19T00:00:00.000Z",
      "endDate": "2026-01-19T00:00:00.000Z",
      "location": {
        "address": "„Ревност“ - театрална постановка 19",
        "city": "Варна",
        "country": "България",
        "coordinates": null
      },
      "category": "Култура",
      "price": 0,
      "isOnline": false,
      "imageUrl": "https://visit.varna.bg/media/cache/df/7e//thumb2_78488.jpg",
      "websiteUrl": "https://visit.varna.bg/bg/event/revnost-teatralna-postanovka.html",
      "isExternal": true,
      "createdAt": "2025-12-09T01:24:12.853Z",
      "creatorId": null,
      "tags": []
    },
    {
      "id": "varna_вашгеоргипарацалевтеатралнапос_20260120",
      "title": "„...Ваш, Георги Парацалев“ - театрална постановка",
      "description": "„...Ваш, Георги Парацалев“ - театрална постановка 20.01.2026 г., 19:30 ч. Фестивален и конгресен център Варна, Зала 2 &bdquo;...Ваш,... Вторник, 20/01/2026г.",
      "startDate": "2026-01-20T00:00:00.000Z",
      "endDate": "2026-01-20T00:00:00.000Z",
      "location": {
        "address": "„...Ваш, Георги Парацалев“ - театрална постановка 20.01.2026 г., 19:30 ч. Фестивален и конгресен цен",
        "city": "Варна",
        "country": "България",
        "coordinates": null
      },
      "category": "Култура",
      "price": 0,
      "isOnline": false,
      "imageUrl": "https://visit.varna.bg/media/cache/c1/c3//thumb2_747.jpg",
      "websiteUrl": "https://visit.varna.bg/bg/event/vash-georgi-paratsalev-teatralna-postanovka.html",
      "isExternal": true,
      "createdAt": "2025-12-09T01:24:12.853Z",
      "creatorId": null,
      "tags": []
    },
    {
      "id": "varna_българскалитературанакраткотеа_20260121",
      "title": "„Българска литература накратко“ - театрална постановка",
      "description": "„Българска литература накратко“ - театрална постановка 21.01.2026 г., 19:00 ч. Зала &bdquo;Славейков\", Кв.&bdquo;Вл. Варненчик&ldquo; &bd... Сряда, 21/01/2026г.",
      "startDate": "2026-01-21T00:00:00.000Z",
      "endDate": "2026-01-21T00:00:00.000Z",
      "location": {
        "address": "„Българска литература накратко“ - театрална постановка 21",
        "city": "Варна",
        "country": "България",
        "coordinates": null
      },
      "category": "Култура",
      "price": 0,
      "isOnline": false,
      "imageUrl": "https://visit.varna.bg/media/cache/65/01//thumb2_686.jpg",
      "websiteUrl": "https://visit.varna.bg/bg/event/balgarska-literatura-nakratko-teatralna-postanovka.html",
      "isExternal": true,
      "createdAt": "2025-12-09T01:24:12.854Z",
      "creatorId": null,
      "tags": []
    },
    {
      "id": "varna_петъквечертеатралнапостановка_20260122",
      "title": "„Петък вечер“ - театрална постановка",
      "description": "„Петък вечер“ - театрална постановка 22.01.2026 г., 19:00 ч. Фестивален и конгресен център Варна &bdquo;Петък ве... Четвъртък, 22/01/2026г.",
      "startDate": "2026-01-22T00:00:00.000Z",
      "endDate": "2026-01-22T00:00:00.000Z",
      "location": {
        "address": "„Петък вечер“ - театрална постановка 22",
        "city": "Варна",
        "country": "България",
        "coordinates": null
      },
      "category": "Култура",
      "price": 0,
      "isOnline": false,
      "imageUrl": "https://visit.varna.bg/media/cache/fd/65//thumb2_444.jpg",
      "websiteUrl": "https://visit.varna.bg/bg/event/petak-vecher-teatralna.html",
      "isExternal": true,
      "createdAt": "2025-12-09T01:24:12.854Z",
      "creatorId": null,
      "tags": []
    },
    {
      "id": "varna_бивалинебивалицитеатралнапоста_20260123",
      "title": "„Бивали небивалици“ - театрална постановка",
      "description": "„Бивали небивалици“ - театрална постановка 23.01.2026 г., 19:00 ч. Зала &bdquo;Славейков\", Кв.&bdquo;Вл. Варненчик&ldquo; Дим... Петък, 23/01/2026г.",
      "startDate": "2026-01-23T00:00:00.000Z",
      "endDate": "2026-01-23T00:00:00.000Z",
      "location": {
        "address": "„Бивали небивалици“ - театрална постановка 23",
        "city": "Варна",
        "country": "България",
        "coordinates": null
      },
      "category": "Култура",
      "price": 0,
      "isOnline": false,
      "imageUrl": "https://visit.varna.bg/media/cache/3f/e0//thumb2_56788.jpg",
      "websiteUrl": "https://visit.varna.bg/bg/event/bivali-nebivalitsi-teatralna-postanovka.html",
      "isExternal": true,
      "createdAt": "2025-12-09T01:24:14.365Z",
      "creatorId": null,
      "tags": []
    },
    {
      "id": "varna_бивалинебивалицитеатралнапоста_20260124",
      "title": "„Бивали небивалици“ - театрална постановка",
      "description": "„Бивали небивалици“ - театрална постановка 24.01.2026 г., 19:00 ч. Фестивален и конгресен център / Зала 1 Димитър Туджаров &ndash;... Събота, 24/01/2026г.",
      "startDate": "2026-01-24T00:00:00.000Z",
      "endDate": "2026-01-24T00:00:00.000Z",
      "location": {
        "address": "„Бивали небивалици“ - театрална постановка 24",
        "city": "Варна",
        "country": "България",
        "coordinates": null
      },
      "category": "Култура",
      "price": 0,
      "isOnline": false,
      "imageUrl": "https://visit.varna.bg/media/cache/b7/79//thumb2_56788.jpg",
      "websiteUrl": "https://visit.varna.bg/bg/event/bivali-nebivalitsi-teatralna.html",
      "isExternal": true,
      "createdAt": "2025-12-09T01:24:14.365Z",
      "creatorId": null,
      "tags": []
    },
    {
      "id": "varna_азкоятотеобичатеатралнапостано_20260125",
      "title": "„Аз, която те обича“ - театрална постановка",
      "description": "„Аз, която те обича“ - театрална постановка 25.01.2026 г., 19:00 ч. Фестивален и конгресен център / Зала 1 &bdquo;Аз, която те обич... Неделя, 25/01/2026г.",
      "startDate": "2026-01-25T00:00:00.000Z",
      "endDate": "2026-01-25T00:00:00.000Z",
      "location": {
        "address": "„Аз, която те обича“ - театрална постановка 25.01.2026 г., 19:00 ч. Фестивален и конгресен център /",
        "city": "Варна",
        "country": "България",
        "coordinates": null
      },
      "category": "Култура",
      "price": 0,
      "isOnline": false,
      "imageUrl": "https://visit.varna.bg/media/cache/df/12//thumb2_53939.jpg",
      "websiteUrl": "https://visit.varna.bg/bg/event/az-koyato-te-obicha-teatralna-postanovka.html",
      "isExternal": true,
      "createdAt": "2025-12-09T01:24:14.365Z",
      "creatorId": null,
      "tags": []
    },
    {
      "id": "varna_василпетровпредставянайголемит_20260127",
      "title": "Васил Петров представя най-големите хитове на всички времена - концерт",
      "description": "Васил Петров представя най-големите хитове на всички времена - концерт 27.01.2026 г., 19:00 ч. Фестивален и конгресен център / Зала 1 Неподражаемият глас на Б... Вторник, 27/01/2026г.",
      "startDate": "2026-01-27T00:00:00.000Z",
      "endDate": "2026-01-27T00:00:00.000Z",
      "location": {
        "address": "Васил Петров представя най-големите хитове на всички времена - концерт 27",
        "city": "Варна",
        "country": "България",
        "coordinates": null
      },
      "category": "Култура",
      "price": 0,
      "isOnline": false,
      "imageUrl": "https://visit.varna.bg/media/cache/be/57//thumb2_6786.jpg",
      "websiteUrl": "https://visit.varna.bg/bg/event/vasil-petrov-predstavya-nay-golemite-hitove-na-vsi.html",
      "isExternal": true,
      "createdAt": "2025-12-09T01:24:14.365Z",
      "creatorId": null,
      "tags": []
    },
    {
      "id": "varna_лазарицатеатралнапостановка_20260206",
      "title": "„Лазарица“ - театрална постановка",
      "description": "„Лазарица“ - театрална постановка 06.02.2026 г., 19:00 ч. Фестивален и конгресен център Варна / Зала 1 &bdquo;Лазар... Петък, 06/02/2026г.",
      "startDate": "2026-02-06T00:00:00.000Z",
      "endDate": "2026-02-06T00:00:00.000Z",
      "location": {
        "address": "„Лазарица“ - театрална постановка 06",
        "city": "Варна",
        "country": "България",
        "coordinates": null
      },
      "category": "Култура",
      "price": 0,
      "isOnline": false,
      "imageUrl": "https://visit.varna.bg/media/cache/3d/b3//thumb2_456.jpg",
      "websiteUrl": "https://visit.varna.bg/bg/event/lazaritsa-teatralna-postanovka.html",
      "isExternal": true,
      "createdAt": "2025-12-09T01:24:14.366Z",
      "creatorId": null,
      "tags": []
    },
    {
      "id": "varna_билетзаамерикатеатралнапостано_20260207",
      "title": "„Билет за Америка“ - театрална постановка",
      "description": "„Билет за Америка“ - театрална постановка 07.02.2026 г., 19:00 ч. Фестивален и конгресен център Варна / Зала 1 &bdquo;Билет... Събота, 07/02/2026г.",
      "startDate": "2026-02-07T00:00:00.000Z",
      "endDate": "2026-02-07T00:00:00.000Z",
      "location": {
        "address": "„Билет за Америка“ - театрална постановка 07",
        "city": "Варна",
        "country": "България",
        "coordinates": null
      },
      "category": "Култура",
      "price": 0,
      "isOnline": false,
      "imageUrl": "https://visit.varna.bg/media/cache/22/5c//thumb2_644.jpg",
      "websiteUrl": "https://visit.varna.bg/bg/event/bilet-za-amerika-teatralna-postanovka.html",
      "isExternal": true,
      "createdAt": "2025-12-09T01:24:14.366Z",
      "creatorId": null,
      "tags": []
    },
    {
      "id": "varna_редкитъпанаритеатралнапостанов_20260214",
      "title": "„Редки тъпанари“ - театрална постановка",
      "description": "„Редки тъпанари“ - театрална постановка 14.02.2026 г., 18:00 ч. Дворец на културата и спорта Варна &bdquo;Редки тъпанари&... Събота, 14/02/2026г.",
      "startDate": "2026-02-14T00:00:00.000Z",
      "endDate": "2026-02-14T00:00:00.000Z",
      "location": {
        "address": null,
        "city": "Варна",
        "country": "България",
        "coordinates": null
      },
      "category": "Спорт",
      "price": 0,
      "isOnline": false,
      "imageUrl": "https://visit.varna.bg/media/cache/57/2c//thumb2_754.jpg",
      "websiteUrl": "https://visit.varna.bg/bg/event/redki-tapanari-teatralna-postanovka.html",
      "isExternal": true,
      "createdAt": "2025-12-09T01:24:14.366Z",
      "creatorId": null,
      "tags": []
    },
    {
      "id": "varna_viennastraussphilharmonieorche_20260222",
      "title": "Vienna Strauss Philharmonie Orchestra - концерт",
      "description": "Vienna Strauss Philharmonie Orchestra - концерт 22.02.2026 г., 18:00 ч. Фестивален и конгресен център - Зала 1 Оркестърът е създаден... Неделя, 22/02/2026г.",
      "startDate": "2026-02-22T00:00:00.000Z",
      "endDate": "2026-02-22T00:00:00.000Z",
      "location": {
        "address": "Vienna Strauss Philharmonie Orchestra - концерт 22",
        "city": "Варна",
        "country": "България",
        "coordinates": null
      },
      "category": "Култура",
      "price": 0,
      "isOnline": false,
      "imageUrl": "https://visit.varna.bg/media/cache/58/ff//thumb2_e_541748.jpg",
      "websiteUrl": "https://visit.varna.bg/bg/event/vienna-strauss-philharmonie-orchestra-kontsert.html",
      "isExternal": true,
      "createdAt": "2025-12-09T01:24:14.366Z",
      "creatorId": null,
      "tags": []
    },
    {
      "id": "varna_концертнаdirestraitslegacy_20260328",
      "title": "Концерт на Dire Straits Legacy",
      "description": "Концерт на Dire Straits Legacy 28.03.2026г., 20:00ч. Дворец на културата и спорта Легендарните Dire Straits Legacy с п... Събота, 28/03/2026г.",
      "startDate": "2026-03-28T00:00:00.000Z",
      "endDate": "2026-03-28T00:00:00.000Z",
      "location": {
        "address": null,
        "city": "Варна",
        "country": "България",
        "coordinates": null
      },
      "category": "Култура",
      "price": 0,
      "isOnline": false,
      "imageUrl": "https://visit.varna.bg/media/cache/33/b1//thumb2_dire.jpg",
      "websiteUrl": "https://visit.varna.bg/bg/event/kontsert-na-dire-straits-legacy.html",
      "isExternal": true,
      "createdAt": "2025-12-09T01:24:14.366Z",
      "creatorId": null,
      "tags": []
    },
    {
      "id": "varna_концертнажулиендасенинеговитег_20260607",
      "title": "Концерт на Жулиен Дасен и неговите гости с оркестър",
      "description": "Концерт на Жулиен Дасен и неговите гости с оркестър 07.06.2026г., 20:00 ч. Летен театър Варна Синът на краля на френския шансон ще изпее... Неделя, 07/06/2026г.",
      "startDate": "2026-06-07T00:00:00.000Z",
      "endDate": "2026-06-07T00:00:00.000Z",
      "location": {
        "address": "Концерт на Жулиен Дасен и неговите гости с оркестър 07",
        "city": "Варна",
        "country": "България",
        "coordinates": null
      },
      "category": "Култура",
      "price": 0,
      "isOnline": false,
      "imageUrl": "https://visit.varna.bg/media/cache/55/56//thumb2_e_a878cfa24bf0b5fff.jpg",
      "websiteUrl": "https://visit.varna.bg/bg/event/kontsert-na-zhulien-dasen-i-negovite-gosti-s-orkes.html",
      "isExternal": true,
      "createdAt": "2025-12-09T01:24:14.366Z",
      "creatorId": null,
      "tags": []
    }
  ],
  "lastUpdated": "2025-12-09T01:24:14.680Z",
  "count": 82
}